{
    "servers": {
		"ntp1.site2.example.com": {
			"options": "minpoll 3 maxpoll 7"
		},
		"ntp2.site2.example.com": {
			"options": "minpoll 3 maxpoll 7"
		},
		",ntp3.site2.example.com": {
			"options": "minpoll 3 maxpoll 7"
		}
    },
    "driftfile": "/var/lib/ntp/drift",
    "enable_stats": "true",
    "statsdir": "/var/log/ntpstats/",
    "statistics": "loopstats peerstats"
}
